type_of_material,news_desk,section_name,combined_text,author
News,Business,Business Day,"The market for new listings has been rough for investors, but the social media company believes it has a secret weapon in its prospectus: its users. Reddit is the latest company set to test the uncertain I.P.O. market, after the unprofitable social media company built around an avid community of newshounds, cryptocurrency devotees and reality TV fans filed to go public. Can Redditors Revive the I.P.O. Market? internal-storyline-no Initial Public Offerings Social Media Reddit Inc Altman, Samuel H Stocks and Bonds Artificial Intelligence Google Inc Bank of America Corporation Goldman Sachs Group Inc JPMorgan Chase & Company Morgan Stanley",Andrew Sorkin
briefing,NYTNow,Briefing,Times reporters found that some parents manage their daughters’ Instagram accounts and sell images to predatory men. The evidence that smartphones damage children’s mental health has continued to grow in recent years. An Instagram Investigation Social Media Instagram Inc Children and Childhood Child Abuse and Neglect Teenagers and Adolescence internal-storyline-no,David Leonhardt
News,Foreign,World,"An appeals court upheld a decision that means Ms. Begum, who has been living in a refugee camp in Syria since 2019, remains effectively stateless. Shamima Begum, who traveled from her home in London to Syria with two friends in 2015 when she was a teenager to join the Islamic State terrorist group, has lost her latest bid to regain her British citizenship. Shamima Begum, Who Joined ISIS as a Teen, Loses Latest Bid to Regain U.K. Citizenship Begum, Shamima Islamic State in Iraq and Syria (ISIS) Terrorism Citizenship and Naturalization Great Britain Syria",Megan Specia
News,Podcasts,Podcasts,"The ruling in former President Donald J. Trump’s civil fraud case could cost him all his available cash. Last week, when a civil court judge in New York ruled against Donald J. Trump, he imposed a set of penalties so severe that they could temporarily sever the former president from his real-estate empire and wipe out all of his cash. Trump’s Cash Crunch Decisions and Verdicts Presidential Election of 2024 New York State Criminal Case Against Trump (71543-23) Trump, Donald J",Michael Barbaro
News,Podcasts,Podcasts,"Plus, the U.S. returns to the moon. The New York Times Audio app is home to journalism and storytelling, and provides news, depth and serendipity. If you haven’t already, download it here — available to Times news subscribers on iOS — and sign up for our weekly newsletter. What’s Troubling Putin, and the Dark Side of Instagram International Relations Computers and the Internet Social Media Embargoes and Sanctions Politics and Government Mobile Applications United States International Relations Telephones and Telecommunications Instagram Inc AT&T Inc",New York Times Audio
News,Arts & Culture,Movies,"Matteo Garrone’s Oscar-nominated feature “Io Capitano” dramatizes the harrowing journeys made by thousands of Africans each month looking for a better life in Europe. At the end of “Io Capitano” (“I Captain”), Matteo Garrone’s harrowing contender for best international film at next month’s Academy Awards, a map tracks the journey taken by the film’s two teenage protagonists: over 3,500 miles from Dakar, Senegal, to Sicily, via the scorching Nigerien desert, horrific Libyan prisons and a nerve-racking Mediterranean crossing aboard a rickety vessel. In This Heroes’ Tale, Real People Risk Their Lives to Get to Europe Movies Academy Awards (Oscars) Middle East and Africa Migrant Crisis Io Capitano (Movie) Garrone, Matteo Africa Senegal Europe",Elisabetta Povoledo
News,Foreign,World,"The blaze spread quickly in a pair of buildings in Valencia, Spain’s third largest city. A day after a fire roared through a high-rise apartment complex in the Spanish city of Valencia, killing at least nine people, police investigators were trying to determine why the flames had engulfed the two buildings in less than an hour. At Least 9 Die as Fire Engulfs High-Rise Complex in Spain Fires and Firefighters Deaths (Fatalities) Valencia (Spain)",Rachel Chaundler
News,Foreign,World,"While Israeli forces have delivered a major blow to Hamas in a fight that has taken a devastating toll on civilians, the group that led the Oct. 7 attack on Israel remains a threat, officials say. As the war in Gaza rages on, the situation in the battered enclave is one of devastation and despair. More than 29,000 people have been killed, according to Gaza health officials, the majority in a relentless Israeli bombing campaign. Neighborhoods have been flattened, families wiped out, children orphaned, and an estimated 1.7 million people displaced. As Gaza War Grinds On, Israel Prepares for a Prolonged Conflict Israel-Gaza War (2023- ) Palestinians Defense and Military Forces Civilian Casualties Hamas Netanyahu, Benjamin Gaza Strip Israel",Adam Rasgon
News,Foreign,World,"Vladimir Putin is drawing on history to position himself in the realm of Russian rulers of the past. Critics say his grip on power is not as strong as it seems. After President Biden called President Vladimir V. Putin of Russia a “crazy S.O.B.” this week, the Kremlin was quick to issue a stern condemnation. Unpredictable Strongman? Two Years Into War, Putin Embraces the Image. Russia Putin, Vladimir V Navalny, Aleksei A Politics and Government Ukraine Russian Invasion of Ukraine (2022) Defense and Military Forces Avdiivka (Ukraine) International Relations United States International Relations Political Prisoners Assassinations and Attempted Assassinations",Anton Troianovski
News,Podcasts,Podcasts,"Some songs to whistle along to. When The New York Times pop music critic Lindsay Zoladz heard that Billy Joel was releasing a new single, it prompted her to return to some of his back catalog, including the 1977 album “The Stranger,” which opens with an iconic whistling solo. “Whistling,” she thought. “What does it offer pop music?” In this playlist, Zoladz explores the wide emotional range of the pop music whistle. In Praise of Whistling in Pop Music Culture (Arts) Joel, Billy Whistling and Whistles Pop and Rock Music",Tina Antolini
News,Foreign,World,"Russia’s invasion came in two phases, many Ukrainians say: the first a decade ago, when it sent soldiers over the border in an unacknowledged military intervention, and the second when it began its full assault two years ago. They were a ragtag army, fighting with baseball bats, Molotov cocktails and plywood shields. But for Ukrainians, the protesters who faced off with riot police on Kyiv’s main square a decade ago were the first soldiers in a war still raging today. For Many Ukrainians, It’s Been a 10-Year War, Not a 2-Year One Russian Invasion of Ukraine (2022) International Relations Demonstrations, Protests and Riots Defense and Military Forces Politics and Government Yanukovych, Viktor F Zelensky, Volodymyr Russia Ukraine Kyiv (Ukraine)",Andrew Kramer
News,Arts & Culture,Movies,"After the death of Russian dissident Aleksei A. Navalny, these four movies examine the war in unexpected ways. Veselka, the Ukrainian diner on Manhattan’s Lower East Side, is one of the few restaurants in the city that truly deserves to be called venerable, even iconic. Mention it to most anyone — especially those of us who were here around the turn of the 21st century — and it provokes pierogi- and borscht-inflected rhapsodies, happy memories of a late-night tuck into a steaming plate of Ukrainian comfort food. Documentary Download: Ukrainian Stories of Sustenance and Strife Documentary Films and Programs Russian Invasion of Ukraine (2022) 20 Days in Mariupol (Movie) A House Made of Splinters (Movie) Donbass (Movie) Veselka: The Rainbow on the Corner at the Center of the World (Book) Veselka (Manhattan, NY, Restaurant) Russia Ukraine",Alissa Wilkinson
Op-Ed,Opinion & Editorial,Opinion,"He joins the hosts to talk inflation, bad vibes and how voters will respond in November. Why does the economy look so good to economists but feel so bad to voters? Will the Economy Favor Biden or Trump? Paul Krugman Weighs In. Biden, Joseph R Jr Trump, Donald J Presidential Election of 2024 United States Economy Inflation (Economics) United States Politics and Government audio-neutral-informative",Michelle Cottle
News,Podcasts,Podcasts,"The mind behind DeepMind. This week’s episode is a conversation with Demis Hassabis, the head of Google’s artificial intelligence division. We talk about Google’s latest A.I. models, Gemini and Gemma; the existential risks of artificial intelligence; his timelines for artificial general intelligence; and what he thinks the world will look like post-A.G.I. Google DeepMind C.E.O. Demis Hassabis on the Path From Chatbots to A.G.I. Science and Technology Hassabis, Demis Google Inc Artificial Intelligence Altman, Samuel H Brin, Sergey Page, Larry",Kevin Roose
Interactive Feature,Other,Arts,"A selection of entertainment highlights this weekend, including Ethan Coen‘s new film, “Drive-Away Dolls.” A selection of entertainment highlights this weekend, including Ethan Coen‘s new film, “Drive-Away Dolls.” 5 Things to Do This Weekend Theater Movies Art Theater (Off Broadway) PlayStation 5 (Video Game System) Museums Circuses Brooklyn Museum New Victory Theater Public Theater Neugebauer, Lila Qualley, Margaret Viswanathan, Geraldine New York City",Danielle Dowling
Interactive Feature,Books,Books,"Selected paperbacks from the Book Review, including titles by Esther Yi, Ralph Ellison, Emily Henry and more.  Selected paperbacks from the Book Review, including titles by Esther Yi, Ralph Ellison, Emily Henry and more.  6 New Paperbacks to Read This Week  Books and Literature Archaeology and Anthropology K-Pop Race and Ethnicity Egyptian Civilization",Shreya Chattopadhyay
Interactive Feature,Other,Business Day,"Regulators in the United States and abroad are trying to crack down on the widespread practice, in which fees are initially hidden from customers. Regulators in the United States and abroad are trying to crack down on the widespread practice, in which fees are initially hidden from customers. It’s a Great Deal, Before the ‘Drip Pricing’ Prices (Fares, Fees and Rates) Regulation and Deregulation of Industry E-Commerce Advertising and Marketing Consumer Protection Federal Trade Commission Khan, Lina Canada Great Britain United States",Santul Nerkar
News,Lifestyle & Leisure,Well,"Why adults should read aloud to one another, and a few recommendations to get you started. A few years ago, my youngest sister, Heather, had a monthlong stretch of migraines. She usually managed to get through her day as a teacher, but at night, she would retreat to a dark room so the light wouldn’t worsen her headache. To distract her from the anxiety and pain, I offered to read aloud to her on speakerphone while she closed her eyes. You’re Never Too Old for Story Time internal-sub-only-nl Books and Literature Memory Content Type: Service Dating and Relationships",Jancee Dunn
Interactive Feature,Other,Briefing,"Did you follow the news this week? Take our quiz to see how well you stack up with other Times readers. Did you follow the news this week? Take our quiz to see how well you stack up with other Times readers. The New York Times News Quiz, Feb. 23, 2024 Content Type: Quiz",
Op-Ed,Opinion & Editorial,Opinion,"The Alabama Supreme Court’s decision that frozen embryos are children is only part of the problem. Despite the lofty and expansive rhetoric of his majority opinion in Dobbs v. Jackson Women’s Health Organization, Justice Samuel Alito insisted throughout the text that the actual decision was more modest than it might appear. The end of Roe, he said, was not the end of abortion access as much as it was the beginning of a new era of democratic deliberation and decision making. No longer shackled by a prior dictate of the Supreme Court, the people were free to choose. “It is time to heed the Constitution and return the issue of abortion to the people’s elected representatives,” Alito wrote. Samuel Alito Opened the Door to Reproductive Hell Abortion Decisions and Verdicts Law and Legislation Conservatism (US Politics) Supreme Courts (State) Birth Control and Family Planning In Vitro Fertilization Constitution (US) Democracy (Theory and Philosophy) Supreme Court (US) Alito, Samuel A Jr Alabama United States Politics and Government",Jamelle Bouie
Op-Ed,Opinion & Editorial,Opinion,"Tuesday’s primary could offer a clue. As infuriated as she is by President Biden’s stalwart support for Israel, Layla Elabed has not ruled out voting for him in November. A progressive Palestinian American community organizer in Dearborn, Mich., a majority Arab American city near Detroit, she doesn’t want to see Donald Trump back in office. Biden Is in Danger of Losing Michigan and, With It, the Whole Election Palestinian-Americans Arab-Americans Israel-Gaza War (2023- ) Biden, Joseph R Jr Presidential Election of 2024 Polls and Public Opinion Voting and Voters Primaries and Caucuses Democratic Party Michigan United States Politics and Government United States International Relations Israel Gaza Strip",Michelle Goldberg
News,Foreign,World,"Governments are seeking to curb donkey skin exports to China, where demand for traditional medicine and other products is threatening animals that rural households need. For years, Chinese companies and their contractors have been slaughtering millions of donkeys across Africa, coveting gelatin from the animals’ hides that is processed into traditional medicines, popular sweets and beauty products in China. Africa’s Donkeys Are Coveted by China. Can the Continent Protect Them? Donkeys China Africa Wildlife Trade and Poaching Animal Abuse, Rights and Welfare International Trade and World Market Gelatin Alternative and Complementary Medicine African Union International Relations audio-neutral-informative audio-neutral-suspenseful",Elian Peltier
News,Style & Fashion,Style,"The audio messages give users the freedom to deliver lengthy, meandering monologues — to the chagrin of some recipients. It has become a common scene. Your phone dings, but instead of a text, it’s a forewarning that someone has orated just for you a private podcast of any imaginable length, the subject unknown until you press play. It could be a juicy morsel of gossip, a yarn replete with twists and turns, or a totally mundane account from someone who simply didn’t have their hands free to type it out. So, You Love Sending Voice Notes. Do Your Friends Love Getting Them? Generation Z Conversation Text Messaging Voice and Speech",Carly Lewis
Review,Books,Books,"In Streisand’s new audiobook recording for her chatty, brick-size memoir, “My Name Is Barbra,” the superlative diva adds a little freestyling. Barbra Streisand’s memoir, “My Name Is Barbra,” exists as a doorstop printed volume and a 48-hour audiobook read by the author. The two are closely related, of course, but not quite the same. As Streisand recites the story of her life — her deprived childhood and her rise to stardom, then auteurdom, then finally lifetime-achievement-award-dom, all while beating back the haters — she ad-libs off the written text, splices sentences, audibly shakes her head at dubious decisions, and altogether places us opposite her on the sofa with a cup of coffee for a two-day kibitz. Barbra Streisand’s Memoir Makes for 48 Vivid, Verklempt Listening Hours My Name Is Barbra (Book) Streisand, Barbra Books and Literature Audiobooks Content Type: Personal Profile",Zachary Woolfe
News,Business,Business Day,"AEG, the entertainment giant, is trying to organize large-scale training camps marketed to fans, as other sports have done. Will it work? On a recent Wednesday afternoon, Dan Perkin and Scott Bissmeyer, work buddies on vacation, sat on metal bleachers watching the Portland Timbers play the San Jose Earthquakes in the first of four preseason Major League Soccer games that day. Spring Training at Coachella: Can M.L.S. Cash In on Its Preseason? Soccer Major League Soccer United Soccer League Coachella Valley (Calif) Fans (Persons)",Ken Belson
briefing,Metro,New York,"Fin whales, the second largest animal on the planet, have been heard year-round off the coast of New York, a recent scientific paper says. Good morning. It’s Friday. Today we’ll hear about some supersized swimmers who sing underwater and who, it turns out, can be found all year in the New York area. We’ll also get details on Nassau County’s ban on sports teams with transgender athletes. New York’s Other Singing Whales New York City internal-storyline-no Whales and Whaling Atlantic Ocean Transgender Athletics and Sports Executive Orders and Memorandums Human Rights and Human Rights Violations Blakeman, Bruce A Nassau County (NY)",James Barron
News,Arts & Culture,Movies,"The awards, which are streaming live on Netflix for the first time, will offer a preview of some key Oscars races. Barbra Streisand will be on hand, too. Cord-cutters rejoice: Normally, watching an awards show involves subscribing to a live TV service (or remembering which of your email addresses you haven’t already used for a free trial). How to Watch the Screen Actors Guild Awards 2024: Date, Time and Streaming Screen Actors Guild Netflix Inc Movies Television Academy Awards (Oscars) Barbie (Movie) Oppenheimer (Movie) Gladstone, Lily Stone, Emma Streisand, Barbra",Sarah Bahr
News,Arts & Culture,Arts,"The comedian was abruptly fired in 2019, just after being named to the cast, when offensive comments he’d made surfaced. Now a rising stand-up star, he is set to appear on the show this weekend. When the comedian Shane Gillis was dropped from “Saturday Night Live” in 2019 just days after the announcement that he’d been added to the Season 45 cast, he lost one of the most sought-after jobs in comedy. Immediately after his addition to the cast, multiple instances surfaced of him using language that the show called “offensive, hurtful and unacceptable” in a statement addressing his ouster. Shane Gillis Bounced Back From ‘S.N.L.’ Debacle. On Saturday, He’ll Host. Gillis, Shane Saturday Night Live (TV Program) Comedy and Humor Television Discrimination Beautiful Dogs (TV Program) Content Type: Personal Profile",Maya Salam
Op-Ed,Opinion & Editorial,Opinion,"Carve the names of climate change deniers deep and large, so that those who come after us need not search the archives. Here is a proposal for the environmental movement: Pool philanthropic funds for a day, buy a small plot of land in Washington, D.C., and put up a tall marble wall to serve as a climate memorial. Carve on this memorial the names of public figures actively denying the existence of climate change. Carve the names so deep and large, our grandchildren and great-grandchildren need not search the archives. Let’s Build a Climate Wall of Shame Global Warming United States Politics and Government",Nate Loewentheil
News,Learning,The Learning Network,And how do they let you know they’re thinking of you? Tucking a note into a lunchbox. Scraping an icy windshield. Grabbing a favorite snack at the convenience store. What Are the Small Ways You Show Love to Those You Care About? ,Natalie Proulx
Op-Ed,Opinion & Editorial,Opinion,"Weighing the risks of an open convention. [You can listen to this episode of “The Ezra Klein Show” on the NYT Audio App, Apple, Spotify, Amazon Music, Google or wherever you get your podcasts.] Your Questions on Open Conventions, a Gaza Schism and Biden’s Chances Biden, Joseph R Jr Presidential Election of 2024 Polls and Public Opinion Democratic Party Democratic National Convention United States Politics and Government audio-neutral-informative",‘The Ezra Klein Show'
News,National,U.S.,"As housing costs soar, Washington State wants to limit annual rent increases to 7 percent. Oregon and California have passed similar measures. For the last 10 years, Dominique Horn has worked for a community health organization in the fast-growing city of Vancouver in Washington State, helping people squeezed by soaring rents to try to avoid homelessness. A New ‘Holy Grail’ in the Housing Crisis: Statewide Rent Caps Rent Control and Stabilization Affordable Housing Real Estate and Housing (Residential) Law and Legislation State Legislatures Landlords Olympia (Wash) Washington (State) Regulation and Deregulation of Industry audio-neutral-informative",David Chen
News,Arts & Culture,Arts,"A 1980 adaptation of the best-selling novel cast it as the tale of a white hero in an exotic Japan. A new version tells a more kaleidoscopic story. Gina Balian, a television executive who had worked on the hit series “Game of Thrones” for HBO, had just left to help FX start a new limited series division when an agent sent her a nearly 1,200-page novel. ‘Shogun’ Remake: This Time, the White Man Is Only One of the Stars Television Shogun (TV Program) FX (TV Network) Hulu.com Clavell, James Jarvis, Cosmo Marks, Justin (Screenwriter) Sanada, Hiroyuki Sawai, Anna Books and Literature Japan",Motoko Rich
News,Politics,U.S.,"Veterans of the conservative, grass-roots movement see the state’s presidential primary as a fight between a “crazy uncle” and a “snowflake niece.” They’ve made their choice. Follow for live updates on the 2024 presidential election. How Did Haley’s South Carolina Become Trump Country? Ask the Tea Party. South Carolina Haley, Nikki R Trump, Donald J Republican Party Presidential Election of 2024 United States Politics and Government Conservatism (US Politics) Tea Party Movement Polls and Public Opinion Primaries and Caucuses Voting and Voters",Charles Homans
News,Arts & Culture,Arts,"Mathilde Laurent, Cartier’s perfumer, has created a scent poem that enhances the experience of Scriabin’s synesthetic score for “Prometheus.” It was time to smell Scriabin’s “Prometheus: The Poem of Fire.” Smell the Music: Inviting a Perfumer Into the Concert Hall Classical Music Perfumes and Fragrances Smell (Olfaction) Prometheus: The Poem of Fire (Musical Work) Laurent, Mathilde Salonen, Esa-Pekka Thibaudet, Jean-Yves Scriabin, Alexander Nikolayevich Cartier SA San Francisco Symphony Davies Symphony Hall San Francisco (Calif)",Joshua Barone
News,Business,Business Day,"Charter schools are popping up in struggling malls as landlords look for alternative tenants and communities seek to increase educational opportunities. In the early morning in November, with a chill still in the air, three lines of cars inch across the open, cracked parking lot at the Sumter Mall in Sumter, S.C. When Science Class Is in a Former Macy’s Charter Schools Shopping Centers and Malls Real Estate (Commercial) Education (K-12) Zoning Area Planning and Renewal Landlords United States",Paul Sullivan
Review,BookReview,Books,"In “Ferris,” a girl and her grandmother are visited by a friendly ghost; in Erin Entrada Kelly’s “The First State of Being,” a boy is visited by a time traveler. It is universally acknowledged that each generation of young people believes it has it worse than previous generations. But today’s kids — who’ve weathered a global pandemic, an existential climate catastrophe that feels more when than if, and TikTok — might hold a unique claim to this unenviable brag. Two wonderful new novels underscore this, allowing anxious readers to travel vicariously to simpler times. Kate DiCamillo’s New Children’s Novel Is a Balm for the Soul Books and Literature Children and Childhood DiCamillo, Kate Ferris (Book) Kelly, Erin Entrada The First State of Being (Book) genre-books-childrens",Gayle Forman
News,Lifestyle & Leisure,Travel,"In this hectic, bustling city, there’s a cafe for every coffee acolyte. Here are seven places where you can try egg coffee and other Vietnamese specialties. Other than Brazil, no nation produces more coffee than Vietnam. Introduced by French colonists in the 19th century, the country’s coffee crop is now a $3 billion business and accounts for nearly 15 percent of the global market, making Vietnam the java giant of Southeast Asia. Finding Great Coffee in Ho Chi Minh City Coffee Coffeehouses Travel and Vacations Ho Chi Minh City (Vietnam)",Seth Sherwood
News,RealEstate,Real Estate,"Instead of rolling down roads, their motorboat floats down rivers — and it’s as cozy as a woodland cabin. Think of it as a floating R.V. Victoria Sass, an interior designer in Minneapolis, had long dreamed of owning an R.V. so she and her family could hit the open road with their living quarters attached. She Wanted an R.V. He Wanted a Sailboat. This Was Their Compromise. Interior Design and Furnishings Restoration and Renovation Boats and Boating",Tim McKeough
Slideshow,Other,Real Estate,She wanted an R.V.; he wanted a sailboat. This was their compromise. She wanted an R.V.; he wanted a sailboat. This was their compromise. A Motorboat as Cozy as a Woodland Cabin Real Estate and Housing (Residential) Interior Design and Furnishings Boats and Boating Home Repairs and Improvements Restoration and Renovation Sustainable Living,
