type_of_material,news_desk,section_name,combined_text,author
News,Politics,U.S.,"The Democratic Governors Association is beginning a multimillion-dollar effort aimed at appointing more state judges. Locked out of power on the Supreme Court and still playing catch-up against Republicans in the federal judiciary, Democrats are hoping to gain a political advantage on a less visible but still important playing field: the state courts. The Quiet Way Democrats Hope to Expand Their Power at the State Level Courts and the Judiciary Democratic Governors Assn Governors (US) Appointments and Executive Changes United States Politics and Government States (US) Democratic Party Republican Governors Assn",Nick Corasaniti
News,Foreign,World,"An account created by Aleksei A. Navalny’s widow on Monday disappeared and then returned hours later. The social media company said the suspension had been a mistake. The social media platform X temporarily suspended on Tuesday an account created by Yulia Navalnaya, the widow of Aleksei A. Navalny, and then restored it, saying it had been mistakenly flagged by its automated security protocols. Yulia Navalnaya’s Account Is Briefly Suspended by X Navalnaya, Yulia B Social Media X (Formerly Twitter) Navalny, Aleksei A Political Prisoners Russia Putin, Vladimir V",Valerie Hopkins
,,,nan nan How to Take Care of Your Skin in the Fall and Winter ,
News,Politics,U.S.,"Nikki Haley, the former South Carolina governor who polls indicate is badly trailing Donald J. Trump with her home state’s primary just days away, will hold a campaign event today addressing the state of the race. Nikki Haley, the former South Carolina governor who polls indicate is badly trailing Donald J. Trump with her home state’s primary just days away, will hold a campaign event today addressing the state of the race. Nikki Haley will address the state of the race today. ",Chris Cameron
News,Business,Business Day,"Mike Pyle, who will leave the administration this month, helped broker agreement with Europe and other allies over clean energy, China and Russian sanctions. In the fall of 2022, two top Biden administration officials met in New York with a key European diplomat. Over dinner outdoors, they strategized about how best to throttle Russia’s oil revenues in retaliation for its invasion of Ukraine. The Quiet Diplomat Who Shaped Biden’s Global Economic Policy United States Politics and Government United States International Relations International Trade and World Market Inflation Reduction Act of 2022 Appointments and Executive Changes Pyle, Mike (1977- ) Biden, Joseph R Jr National Security Council European Union",Jim Tankersley
News,Foreign,World,"In a measured public statement, the heir to the British throne said that “too many have been killed” in the war between Israel and Hamas. Prince William, the heir to the British throne, called on Tuesday for an end to the fighting in Gaza as soon as possible in a rare, if measured, public statement on the bloody conflict between Israel and Hamas. Prince William Calls for End to Gaza Fighting ‘as Soon as Possible’ William, Duke of Cambridge Royal Families Israel-Gaza War (2023- )",Stephen Castle
,,,nan nan Who was Aleksei Navalny? ,
briefing,National,U.S.,"In Dana Point, three cliffside mansions teeter on the edge of beauty and peril after storms seemed to weaken the ground beneath them. Few places are as enjoyable as the headlands in Dana Point, where ocean waves lap rhythmically at the coastline and, on a clear day, the outline of Santa Catalina Island emerges from the Pacific Ocean, the silhouette of a bold sentry in the distance. Living on the Edge in California California",Vik Jolly
Interactive Feature,U.S.,U.S.,"A lawsuit says that investigators for the Administration for Children’s Services deceive and bully their way into people’s homes, where they rifle through families’ most private spaces, strip-search children and humiliate parents. A lawsuit says that investigators for the Administration for Children’s Services deceive and bully their way into people’s homes, where they rifle through families’ most private spaces, strip-search children and humiliate parents. Agency for Protecting Children Traumatizes Families, Lawsuit Says ",
News,Metro,New York,"Lawyers for a group of New York City parents argue that the Administration for Children’s Services uses “coercive tactics” that traumatize the families it is charged with protecting. A sweeping class-action lawsuit filed against New York City on Tuesday argues that the agency that investigates child abuse and neglect routinely engages in unconstitutional practices that traumatize the families it is charged with protecting. Child Abuse Investigators Traumatize Families, Lawsuit Charges Child Abuse and Neglect Suits and Litigation (Civil) Fourth Amendment (US Constitution) Black People Blacks Foster Care Administration for Children's Services (NYC) Family Justice Law Center New York City audio-neutral-informative",Jonah Bromwich
News,Foreign,World,"The hearings, which focus on Israel’s occupation of the West Bank and East Jerusalem, make up one of the two matters regarding Israel currently before the International Court of Justice. At a hearing before the U.N.’s highest court, South Africa on Tuesday called Israel’s policies toward Palestinians an “extreme form of apartheid” and argued that its occupation of territory sought for an eventual Palestinian state was “fundamentally illegal.” South Africa Says Palestinians Are Enduring ‘Extreme Form of Apartheid’ Israel-Gaza War (2023- ) War Crimes, Genocide and Crimes Against Humanity International Relations Palestinians International Court of Justice (UN) Israel Gaza Strip South Africa",Marlise Simons
News,Business,Business Day,"Food companies are talking about smaller price increases this year, good news for grocery shoppers, restaurant diners and the White House. Few prices are as visible to Americans as the ones they encounter at the grocery store or drive-through window, which is why two years of rapid food inflation have been a major drag for U.S. households and the Biden administration. Will Food Prices Stop Rising Quickly? Many Companies Say Yes. Supermarkets and Grocery Stores Restaurants Prices (Fares, Fees and Rates) Food Consumer Behavior Inflation (Economics) Biden, Joseph R Jr United States Economy United States Politics and Government Presidential Election of 2024",Jeanna Smialek
News,Business,Business Day,"Regulators have been tough on big financial mergers, though there are nuances in Capital One’s $35.3 billion takeover bid for Discover. Capital One’s $35.3 billion takeover to buy Discover Financial Services will create a colossus in the fast-growing credit card industry and a more powerful force in the payment networks that underpin the consumer economy. Unpacking the Washington Math for a Big Payment Deal internal-storyline-no Banking and Financial Institutions Mergers, Acquisitions and Divestitures Credit Cards Antitrust Laws and Competition Issues Capital One Financial Corporation Discover Financial Services Visa Inc MasterCard Inc",Andrew Sorkin
News,Express,U.S.,"The men, who were described as experienced fishermen, set out for a boating trip on Saturday from Venice, Fla., and did not return home, the authorities said. The United States Coast Guard has called off a search for four missing boaters who set out Saturday morning for a day of fishing off Florida’s Gulf Coast and never returned home. Coast Guard Suspends Search for Four Missing Fishermen Off Florida Gulf Coast Maritime Accidents and Safety Missing Persons Boats and Boating Florida Gulf of Mexico Sarasota (Fla)",Derrick Taylor
News,Business,Business Day,"The number of transactions at the retail giant rose 4.3 percent, but the average ticket price decreased by 0.3 percent, a sign that shoppers spent a little less during shopping trips. Walmart, the nation’s largest retailer, said on Tuesday that sales rose in the fourth quarter over the previous year, offering one of the first looks at how Americans shopped during the crucial holiday season. Walmart Reports Rising Holiday Sales as Shoppers Seek Value Walmart Stores Inc Company Reports Shopping and Retail Stocks and Bonds Consumer Behavior United States Economy",Jordyn Holman
News,Foreign,World,"The country’s main security agency said the 33-year-old detainee lived in Los Angeles. A lawyers group said she was accused of donating $50 to the war effort. Russia’s main security agency said on Tuesday that it had arrested a dual citizen of Russia and the United States on accusations of committing state treason by raising funds for Ukraine. Russia Arrests U.S. Citizen, Accusing Her of Treason by Aiding Ukraine Russia United States International Relations Treason and Sedition Russian Invasion of Ukraine (2022) Federal Security Service",Ivan Nechepurenko
briefing,NYTNow,Briefing,"A looming battle in the southern Gaza city embodies the brutal dynamics of the conflict. The looming battle for Rafah — a city on the southern end of Gaza, farthest from where Israel’s invasion began — embodies the brutal dynamics of the conflict. The war is both a military operation against Hamas, an extremist organization that has vowed more terrorist attacks against Israel, and a humanitarian crisis that has brought death, hunger and displacement to Gazan civilians. Three Questions About Rafah internal-storyline-no Israel-Gaza War (2023- ) Rafah (Gaza Strip)",David Leonhardt
News,Podcasts,Podcasts,Two Gazans on life in the territory’s southernmost city. This episode contains strong language and descriptions of war. Stranded in Rafah as an Israeli Invasion Looms Evacuations and Evacuees Gaza Strip Israel Rafah (Gaza Strip),Sabrina Tavernise
News,Podcasts,Podcasts,"Plus, satellites could soon be looking right at you. The New York Times Audio app is home to journalism and storytelling, and provides news, depth and serendipity. If you haven’t already, download it here — available to Times news subscribers on iOS — and sign up for our weekly newsletter. A U.S. Cease-Fire Proposal, and Navalny’s Widow’s Pledge Peace Process Capital One Financial Corporation Discover Financial Services Gaza Strip Israel Rafah (Gaza Strip) United States",New York Times Audio
News,Style & Fashion,Style,"Burberry, JW Anderson, Erdem and Simone Rocha flew the flag for British design talent this season as LFW celebrated a milestone. It was the Sunday of London Fashion Week and the last model had just stepped off the runway at the JW Anderson show. A heaving scrum soon descended on the designer, a sea of phones held aloft like antennas. Jonathan Anderson’s collection had been a nostalgic British jumble of chunky knits and trench coats, school uniform staples, retro thermal underwear sets and hats like Grandma’s gray pin-curl wigs, all chucked into a subversive tumble dryer for a warped take on what once felt familiar. Why? Furry Trims and Nosy Neighbors: How London Fashion Week Turned 40 Fashion and Apparel London Fashion Week Parties (Social) British Academy of Film and Television British Fashion Council Anderson, Jonathan William (1984- ) Findikoglu, Dilara Wickstead, Emilia Goddard, Molly Lee, Daniel (Designer) Rocha, Simone London (England) your-feed-fashion",Elizabeth Paton
News,Arts & Culture,Movies,"As the director of “Lisa Frankenstein,” she embraced a tale in which no one was concerned whether grief was palatable to others. Zelda Williams never intended a teenage zombie rom-com to be her feature filmmaking debut. For one thing, the project, “Lisa Frankenstein,” was a big concept to sell, a high-camp period piece set in the fuchsia-and-teal ’80s. There was grief, violence and a floofy-haired love interest who was — not to put too fine a point on it — not only mute but dead. For Zelda Williams, Daughter of Robin, a Goth Zombie Comedy Is Cathartic Movies Content Type: Personal Profile Cody, Diablo Sprouse, Cole Williams, Robin Williams, Zelda Lisa Frankenstein (Movie)",Melena Ryzik
News,Magazine,Magazine,"He turned last year’s season of ‘Vanderpump Rules’ into the best in reality TV’s history — and ruined his life in the process. Valley Village is a Los Angeles neighborhood just across the freeway from Studio City, near the southern edge of the area locally referred to with both affection and derision as the Valley. There, at the end of a quiet, leafy street of ranch-style homes stands what real estate agents have come to describe as a “modern farmhouse,” which its current occupant, the reality-TV star Tom Sandoval, has outfitted with landscaping lights that rotate in a spectrum of colors, mimicking the dance floor of a nightclub. The home is both his private residence and an occasional TV set for the Bravo reality show “Vanderpump Rules.” After a series of events that came to be known as “Scandoval,” paparazzi had been camped outside, but by the new year it was just one or two guys, and now they have mostly gone, too. How Tom Sandoval Became the Most Hated Man in America Sandoval, Tom (1983- ) Vanderpump Rules (TV Program) Madix, Ariana (1985- ) Reality Television Celebrities Cohen, Andy (1968- ) Leviss, Raquel (1994- ) Content Type: Personal Profile",Irina Aleksander
News,Style & Fashion,Style,"The essayist Leslie Jamison has become known for her careful balancing acts of self-exposure. “If the self is a guesthouse, most of the rooms are full of ghosts,” Leslie Jamison said on a recent Monday afternoon in a Columbia University lecture hall. Ms. Jamison, wearing an ethereal blue maxi dress, stood before a projector screen showing 19th-century spirit photography. “Being haunted can be a state of abundance,” she said. “Living in the ghost hotel is a state of abundance. Memories are raw material.” A Writer With Skin in the Game Jamison, Leslie Books and Literature Writing and Writers Content Type: Personal Profile",Kate Dwyer
News,RealEstate,Real Estate,"They didn’t expect their new Brooklyn home to flood a week after they moved in. But ‘with the destruction, there was an opportunity.’ After years of renting, Jackson Owens and Flora Jin bought a loft in Bedford-Stuyvesant, Brooklyn, and it felt like the stuff of dreams. A week or so later, it was more like a nightmare. A Bed-Stuy Loft Transformed With an Out-of-the-Ordinary Renovation Real Estate and Housing (Residential) Interior Design and Furnishings Home Repairs and Improvements Bedford-Stuyvesant (Brooklyn, NY)",Tim McKeough
News,Learning,The Learning Network,"Photos, handwritten notes, stubs from movies and concerts — are these keepsakes to cherish or clutter that’s destined for the trash? Do you know anyone who saves things that are meant to commemorate events and serve as reminders of special moments? Are you such a person? How Important Is It to You to Keep Mementos From Your Life? ",Shannon Doyne
Review,Arts & Culture,Theater,"Dael Orlandersmith’s slender new solo play is a meditation on living that seems also like a curveball response to loss. To Virgil, the audience’s guide through Dael Orlandersmith’s slender, searching new solo play, “Spiritus/Virgil’s Dance,” there is something hellish in the sight of the miserable masses commuting to dreaded jobs that bring them nothing more than the ability to survive. Review: Seeking Purpose Among the Dead in ‘Spiritus/Virgil’s Dance’ Theater Theater (Off Broadway) Spiritus/Virgil's Dance (Play) Orlandersmith, Dael Keller, Neel Rattlestick Playwrights Theater",Laura Collins-Hughes
Slideshow,Other,Real Estate,"They didn’t expect their new Brooklyn home to flood a week after they moved in. But they found a silver lining. They didn’t expect their new Brooklyn home to flood a week after they moved in. But they found a silver lining. ‘With Destruction, There Was an Opportunity’ Real Estate and Housing (Residential) Restoration and Renovation Interior Design and Furnishings Home Repairs and Improvements Bedford-Stuyvesant (Brooklyn, NY)",
News,Podcasts,Podcasts,"Her new memoir “Splinters” ties them all together with stunning prose. Charles Finch, a contributor to The New York Times Book Review, can’t stop thinking about Leslie Jamison’s new memoir, “Splinters: Another Kind of Love Story.” There are a lot of books about motherhood. There are a lot of books about divorce. This is a book of unusually clear intelligence and compassion, he says. “Splinters” was published on February 20, 2024. The Many Selves of Leslie Jamison Culture (Arts) Jamison, Leslie MEMOIRS (BOOK) Divorce, Separations and Annulments Parenting",Sara Curtis
Op-Ed,Opinion & Editorial,Opinion,"Alvin Bragg is hoping to reinforce a principle about business and our democracy. With Justice Juan Merchan’s proclamation last week that jury selection in the Manhattan prosecution of Donald Trump will begin on March 25, it is time for a reappraisal of the case. The charges brought by Alvin Bragg, the Manhattan district attorney, have been overshadowed by the three other criminal prosecutions of Mr. Trump, but the 34 felony counts constitute a strong case of election interference and fraud in the place where Mr. Trump lived and conducted business for decades. There Is Much More at Stake in Trump’s Manhattan Case Than Just Hush Money New York State Criminal Case Against Trump (71543-23) Presidential Election of 2024 Presidential Election of 2016 Trump, Donald J Watergate Affair Bragg, Alvin Nixon, Richard Milhous Cohen, Michael D (1966- ) Hellerstein, Alvin K Merchan, Juan M",Norman Eisen
Op-Ed,Opinion & Editorial,Opinion,"I worry Biden will be remembered not as the president who saved American democracy but as the president who sacrificed it for Netanyahu. “Dearborn doesn’t sleep,” I recently told an out-of-state visitor to my hometown. I’m the Mayor of Dearborn, Mich., and My City Feels Betrayed Palestinians United States Politics and Government Israel-Gaza War (2023- ) Primaries and Caucuses Presidential Election of 2024 Arab-Americans Civilian Casualties Democratic Party Biden, Joseph R Jr Dearborn (Mich) Gaza Strip West Bank",Abdullah Hammoud
News,Lifestyle & Leisure,Food,"The bubbly host of a new TV food-and-travel series plays up the comedy, but her ascent has required navigating setbacks like the demise of “The Chew.” Carla Hall’s tarot card reading was running long. Astrology, numerology, psychics, the Chinese zodiac — she’s open to all manner of metaphysical messaging. For Carla Hall, It’s Been a Bumpy Climb to a ‘Top Chef’ Life Hall, Carla Content Type: Personal Profile Television Chefs Food Chasing Flavor (TV Program)",Kim Severson
Op-Ed,Opinion & Editorial,Opinion,"The philosopher Baruch Spinoza’s commitment to free thought and reason is sorely needed in our time of demagogues and dogma. The Enlightenment philosopher Baruch Spinoza almost died for his ideals one day in 1672. The 17th-Century Heretic We Could Really Use Now Books and Literature Religion and Belief Philosophy Book Bans Freedom of Speech and Expression Spinoza, Baruch Europe",Ian Buruma
News,Business,Technology,"The company raised $7.3 billion over the last year, as the lure of artificial intelligence changes Silicon Valley deal-making. Last May, Anthropic, one of the world’s hottest artificial intelligence start-ups, raised $450 million from investors including Google and Salesforce. It was the beginning of an astonishing funding spree. Inside the Funding Frenzy at Anthropic, One of A.I.’s Hottest Start-Ups Artificial Intelligence Computers and the Internet Venture Capital Start-ups Entrepreneurship Cloud Computing Antitrust Laws and Competition Issues Computer Chips Anthropic AI LLC Amazon.com Inc Google Inc HK FTX Trading Ltd (Futures Exchange) Menlo Ventures IX LP Amodei, Dario",Erin Griffith
News,Arts & Culture,Arts,"The Philharmonic’s maestro ends his tenure, Igor Levit comes to Carnegie Hall, and the Metropolitan Opera takes a chance on reviving two recent hits. The New York Philharmonic’s spring gala is not usually of much musical interest. It tends toward mild fare — just enough to keep the donors happy before dinner and dancing. Jaap van Zweden Bids Farewell, and Other Classical Highlights Classical Music Opera Carnegie Hall New York Philharmonic Metropolitan Opera El Nino (Opera) Fire Shut Up in My Bones (Opera) Madama Butterfly (Opera) Adams, John (1947- ) Ades, Thomas Canellakis, Karina Dudamel, Gustavo DiDonato, Joyce Fleming, Renee Grigorian, Asmik Gubaidulina, Sofia O'Hara, Kelli Puts, Kevin Lemmons, Kasi Levit, Igor",Zachary Woolfe
briefing,Metro,New York,"Arthur Dukes, CUNY’s player of the year, went through hard times before he broke out at LaGuardia Community College. Good morning. Today we’ll find out about the improbable story of how someone went from playing pickup basketball to being a star at LaGuardia Community College in Queens. We’ll also look at former Gov. Andrew Cuomo’s effort to torpedo a state ethics commission. He Wanted to Play Basketball. He Finally Got the Chance. New York City internal-storyline-no Ethics and Official Misconduct Colleges and Universities Community Colleges College Athletics Basketball Sexual Harassment City University of New York Commission on Ethics and Lobbying in Government (NYS) LaGuardia Community College Cuomo, Andrew M Mohawk Valley (NY) Queens (NYC)",James Barron
Op-Ed,Opinion & Editorial,Opinion,"Both a ceremonial custom and a dynamic sport, lion dancing is a cultural practice that spans generations and continents. I was born in Sydney, Australia, as the only child of parents who immigrated from China with little financial security or knowledge of English. I spent most of my childhood in Sydney’s Chinatown, by my mother’s side during school holidays as she worked the checkout at a Chinese supermarket. To Become a Lion Documentary Films and Programs Lunar New Year Dancing Martial Arts Sydney (Australia) Powerhouse Museum (Sydney, Australia) China",David Ma
Video,,World,"When war broke out in Gaza on Oct.7, Motaz Azaiza, a Palestinian photographer, turned his camera to covering pain and loss in a territory under siege. In doing so, he attracted millions of followers — documenting the war while also trying to survive it. When war broke out in Gaza on Oct.7, Motaz Azaiza, a Palestinian photographer, turned his camera to covering pain and loss in a territory under siege. In doing so, he attracted millions of followers — documenting the war while also trying to survive it. Motaz Azaiza Captured Gaza’s Suffering. But ‘Nothing Changed.’ Israel-Gaza War (2023- ) Israel Gaza Strip Palestinians Social Media Committee to Protect Journalists Civilian Casualties Refugees and Displaced Persons Humanitarian Aid",Neil Collier
News,Arts & Culture,Theater,"Eighteen openings in two months will drive everyone crazy. But maybe there should be even more. Broadway is the pinnacle of the commercial theater, a billion-dollar cultural enterprise and a jewel of New York City. So why is it run like a Christmas tree farm? Broadway’s Crunchtime Is Also Its Best Life Theater Theater (Broadway) Theater (Off Broadway) New York City An Enemy of the People (Play) Cabaret (Play) Doubt (Play) Hell's Kitchen (Play) Lempicka (Play) Mary Jane (Play) Mother Play (Play) Stereophonic (Play) Suffs (Play) The Great Gatsby, A New Musical (Play) The Heart of Rock and Roll (Play) The Notebook (Play) The Outsiders (Play) The Wiz (Play) Uncle Vanya (Play) Water for Elephants (Play)",Jesse Green
Op-Ed,Opinion & Editorial,Opinion,"Forcing Indigenous people out of protected areas they help manage and rely on is not the way to achieve biodiversity and climate goals. Over 600,000 tourists travel to Tanzania’s Ngorongoro Conservation Area each year, and many will catch a glimpse of the Great Migration: the famed trek of more than one million wildebeests and thousands of zebras, gazelles and other animals crossing over the Mara River into Kenya and back. Yet the Tanzanian government believes it can attract many more tourists seeking the safari adventure of a lifetime: five million by 2025, bringing $6 billion with them per year, according to a recent plan. Kicking Native People Off Their Land Is a Horrible Way to Save the Planet Biodiversity Indigenous People Conservation of Resources Land Use Policies Eco-Tourism",Robert Williams
News,Style & Fashion,Style,"A day with Brett Heyman, the designer who is trying to push the legal cannabis market in a more stylish, sunny direction. Two weeks ago, an accessories designer named Brett Heyman sold weed, legally, for the first time in New York City. Selling Weed, but Making It Fashion Heyman, Brett (Designer) Edie Parker (Fashion Label) Cannabis Foods and Products Marijuana Content Type: Personal Profile Fashion and Apparel New York City",Jessica Testa
