type_of_material,news_desk,section_name,combined_text,author
News,Politics,U.S.,"Speaking with supporters in a call on Wednesday, Gov. Ron DeSantis of Florida said he would not be Donald J. Trump’s vice president. Gov. Ron DeSantis of Florida told supporters in a call on Wednesday that he would not want to be Donald J. Trump’s vice president, suggested it would be a “mistake” for Mr. Trump to consider “identity politics” in making his selection for a running mate and left wide open the door to a 2028 presidential run. DeSantis, in Private Call, Sounds Off on Trump and Conservative News Media Presidential Election of 2024 DeSantis, Ron Trump, Donald J Wiles, Susie News and News Media",Shane Goldmacher
Interactive Feature,U.S.,U.S.,The Alabama Supreme Court has ruled that frozen embryos should be considered children. The Alabama Supreme Court has ruled that frozen embryos should be considered children. Read the Alabama Supreme Court’s Ruling ,
News,Express,Business Day,"Fayette Janitorial employed at least 24 children between the ages of 13 and 17 to work overnight shifts cleaning dangerous equipment at plants in Virginia and Iowa, federal regulators said. A Tennessee-based company employed at least two dozen children as young as 13 to work overnight shifts cleaning dangerous equipment in slaughterhouses, including a 14-year-old whose arm was mangled in a piece of machinery, the Labor Department said on Wednesday. Company Hired 24 Minors to Clean Slaughterhouses, Labor Department Says Child Labor Meatpacking Plants and Slaughterhouses Cleaning Services Workplace Hazards and Violations Regulation and Deregulation of Industry Illegal Immigration Fayette Janitorial Service LLC Perdue Farms Inc Seaboard Triumph Foods LLC Tyson Foods Inc Labor Department (US) Accomack County (Va) Sioux City (Iowa) Iowa Virginia",Rebecca Carballo
News,Express,U.S.,"The 7-year-old was on vacation with her family from Indiana when she and her brother became trapped in the sand at Lauderdale-by-the-Sea, the authorities said. A 7-year-old girl died on Tuesday after the hole she was digging with her brother at a Florida beach collapsed, burying the pair in sand, the authorities said — one of a few instances in which such an episode turns deadly each year in the United States. Girl Dies After Digging Hole at Florida Beach, Authorities Say Deaths (Fatalities) Beaches Accidents and Safety Children and Childhood Rescues Florida",Livia Albeck-Ripka
News,Metro,New York,"Officials had committed to making sure that 50 percent of the city’s taxi fleet could accommodate wheelchair users by 2023. A lawsuit says they have fallen short. Advocates for New Yorkers with disabilities have sued taxi regulators for falling short of complying with a legal settlement that required half of the city’s licensed taxis to be wheelchair-accessible. New York Is Failing to Meet Wheelchair-Access Goal for Cabs, Suit Says Disabilities Regulation and Deregulation of Industry Suits and Litigation (Civil) Wheelchairs Taxicabs and Taxicab Drivers Car Services and Livery Cabs Taxi and Limousine Commission",Ana Ley
News,Washington,U.S.,"The action under consideration could prevent people from making asylum claims during border crossing surges. The White House says it is far from a decision on the matter. President Biden is considering executive action that could prevent people who cross illegally into the United States from claiming asylum, several people with knowledge of the proposal said Wednesday. The move would suspend longtime guarantees that give anyone who steps onto U.S. soil the right to ask for safe haven. Biden Mulling Plan That Could Restrict Asylum Claims at the Border Biden, Joseph R Jr Executive Orders and Memorandums Asylum, Right of Illegal Immigration Immigration and Emigration United States Politics and Government Republican Party Trump, Donald J",Hamed Aleaziz
News,Washington,U.S.,"A federal judge found that prosecutors were biased in pursuing charges against the two men and not against far-left activists who had also committed acts of violence at the same events. A federal judge on Wednesday dismissed riot charges against two members of a neo-Nazi street gang who had attacked counterprotesters at several pro-Trump rallies in California in 2017, saying that the government had behaved improperly by neglecting to bring charges against left-wing activists who had also acted violently at the same events. Charges Against Two White Nationalists Are Dismissed as ‘Selective Prosecution’ Decisions and Verdicts Demonstrations, Protests and Riots Right-Wing Extremism and Alt-Right Neo Nazi Groups Antifa Movement (US) Discrimination Carney, Cormac J California Trump, Donald J",Alan Feuer
News,Style & Fashion,Style,"The celebrations continued as the music collective 88rising hosted a gala in Los Angeles and the New York Philharmonic marked the Year of the Dragon in Manhattan. On Saturday evening in Los Angeles, the Lunar New Year celebrations continued as Hollywood’s Milk Studios was transformed for the inaugural Moonrise Gala by 88rising, the pan-Asian music collective and record label. A Look at 2 Lunar New Year Bashes, Worlds Apart Lunar New Year New Year Classical Music Parties (Social) Culture (Arts) 88rising (Live Nation Entertainment Inc) Geffen, David, Hall (Manhattan, NY) Milk Studios New York Philharmonic",Sonaiya Kelley
Op-Ed,Opinion & Editorial,Opinion,"To those advancing Christian nationalism, the will of God counts more than the will of the American people. If you don’t think this country is sliding toward theocracy, you’re not paying attention. Alabama’s I.V.F. Ruling Shows Our Slide Toward Theocracy Law and Legislation Abortion In Vitro Fertilization Trump, Donald J Republican Party Christians and Christianity United States Politics and Government Alabama Supreme Courts (State)",Charles None
News,Politics,U.S.,"More than 70 bills in at least 25 states draw some connection to election conspiracy theories. In the conspiracy-soaked aftermath of the 2020 election, far-right activists clamored to inspect ballots based on elaborate — and false — theories. Election Deniers Seek to Rewrite the Law Elections Voting Machines Absentee Voting Voting Rights Lab (Nonprofit) Brennan Center for Justice Trump, Donald J",Nick Corasaniti
Recipe,,,"nan This American diner classic — a battered and grilled ham, turkey and cheese sandwich dusted with confectioners’ sugar  — may, in fact, be a descendant of the French <a href=""https://cooking.nytimes.com/recipes/1017345-croque-monsieur""><span>croque-monsieur</span></a>. The two are quite similar, the main difference being that the croque-monsieur has a layer of <a href=""https://cooking.nytimes.com/recipes/1023358-bechamel-sauce""><span>béchamel</span></a> on top, while the Monte Cristo is dipped in beaten egg before it’s griddled. The Monte Cristo became popular when a restaurant at Disneyland began serving it in the 1960s, and now, it lives on as a fixture on menus around the country. It's a delicious way to use leftover <a href=""https://cooking.nytimes.com/recipes/1023093-honey-baked-ham""><span>baked ham</span></a>, but regular deli meat works well, too. (Feel free to omit the turkey and use twice as much ham, if you prefer.) As with most grilled sandwiches, thinner slices of cheese will melt more easily.  Monte Cristo ",Lidey Heuck
Recipe,,,"nan Baking salmon gently at a low temperature is a low-effort approach that results in a flaky, moist piece of fish. This simple preparation utilizes oranges, but lemons would work nicely, too. You’ll reduce some fresh orange juice in a skillet to concentrate its flavor, then whisk in some honey to sweeten. The glaze gets drizzled over the salmon before baking, but also doubles as a dressing for salad greens. Keep this dish simple, with just its side of greens, or pair this easy weeknight meal with cilantro rice or olive oil mashed potatoes. Orange-Glazed Baked Salmon ",Farideh Sadeghin
Recipe,,,"nan High in comfort, low in fuss, this pearl barley soup answers the question of what to cook when one doesn’t feel like cooking. Made with pantry staples, this simple soup beams with vibrancy. Lemon transforms this hearty soup into a dish that also feels light and restorative, while dill, used generously, reinforces the citrus flavor while bringing an assertive herbaceous edge. Other herbs could step in for dill; consider parsley, cilantro or chives. Spinach is added right at the end, after the heat is turned off, which ensures that the greens maintain a little bite and stay bright. The soup will thicken over time, so if you are making it ahead or have leftovers, simply loosen it up with more stock or water when reheating. Lemony Pearl Barley Soup ",Hetty McKinnon
Recipe,,,"nan Crispy, golden-brown pillows that are sweet or savory, sopapillas are a traditional New Mexican fried dough made with only five ingredients: flour, baking powder, sugar, salt and shortening. The dish is rooted in the American Southwest, where Hispanic, Spanish and Native American cultures converge. Sopapillas, also spelled sopaipillas, can be stuffed with braised meat, New Mexican chiles or cheese and served as a meal or snack, or the entire pastry can be drizzled with honey for dessert, as it is here. To ensure maximum puffiness, roll the dough out thinly, and the oil should be very hot. Sopapillas are best served right after frying. Sopapillas ",Farideh Sadeghin
,,,"In a time-honored tradition, marriage gave me a life partner and my first good kitchen gear—including two shiny All-Clad skillets. During that first year of marriage, between hosting dinner parties and cooking extravagant meals for two, I’d admire the glimmering skillets, which seemed to symbolize, in a small way, adulthood. Sure, I was hitched. But... In a time-honored tradition, marriage gave me a life partner and my first good kitchen gear—including two shiny All-Clad skillets. During that first year of marriage, between hosting dinner parties and cooking extravagant meals for two, I’d admire the glimmering skillets, which seemed to symbolize, in a small way, adulthood. Sure, I was hitched. But... This Cleaning Powder Was Invented in the 1880s. It Still Keeps My Kitchen Gear Looking New. ",
,,,All Our Favorite Picks From OXO All Our Favorite Picks From OXO All Our Favorite Picks From OXO ,
News,Science,Health,"A ruling by the state’s Supreme Court could change common practices at fertility clinics in the state and possibly nationwide. The Alabama Supreme Court has opened a new front in the legal debate over when human life begins. Embryos created and stored in a medical facility must be considered children under the state’s law governing harmful death, the court ruled. Alabama Says Embryos in a Lab Are Children. What Are the Implications? your-feed-science your-feed-healthcare Decisions and Verdicts Suits and Litigation (Civil) Embryos (Human) In Vitro Fertilization Abortion Law and Legislation States (US) Supreme Courts (State) Regulation and Deregulation of Industry Alabama",Jan Hoffman
Obituary (Obit),Obits,Style,"For nearly two decades he traveled to factories throughout Europe, sometimes behind the Iron Curtain, to bring modern furniture to Americans. Charles Stendig, who introduced contemporary and avant-garde European furniture to adventurous Americans in his New York City showroom, died on Feb. 11 at his home in Manhattan. He was 99. Charles Stendig Dies at 99; Introduced Fanciful Furniture From Abroad Stendig, Charles (1924-2024) Deaths (Obituaries) Design Furniture Interior Design and Furnishings New York City Europe",Penelope Green
News,Style & Fashion,Style,"Mrs. Prada became a legend in fashion for having invented a unique, counterintuitive aesthetic, at once thought-provoking and alluring. Throughout Vogue’s history, its typical cover stars have included a parade of youthful beauties: models, actresses, celebrities, the occasional stunning athlete and, once in a while, a politician or first lady — all glammed to the max.  At 74, Miuccia Prada Makes an Unexpected Vogue Cover Model Fashion and Apparel Magazines Vogue Fondazione Prada Prada Foundation Prada, Miuccia",Rhonda Garelick
News,Style & Fashion,Style,"Less punk. More hyperpop. An anniversary party at the Market Hotel was more about the present than the past. Just before midnight on Saturday, hard techno began pulsating from the Market Hotel, a D.I.Y. music venue located beside the elevated tracks of a Myrtle Avenue subway station in Bushwick, Brooklyn. A crowd of 20-somethings, many of them wearing sunglasses, ripped jeans and fanny packs, lined up in the cold before they threw themselves onto the dance floor. A Brooklyn D.I.Y. Landmark Changes With the Times Bars and Nightclubs Music Dancing Market Hotel (Brooklyn, NY, Music Venue) Bushwick (Brooklyn, NY)",Alex Vadukul
News,Business,Business Day,"The National Labor Relations Board said that Home Depot violated federal law in 2021 when it told a worker that they must quit or stop showing support for the Black Lives Matter movement on their apron. Home Depot must reinstate a worker who quit after they refused to remove a slogan supporting the Black Lives Matter movement from their apron, the National Labor Relations Board announced on Wednesday after it found that the worker’s actions were protected by federal law. Home Depot Is Ordered to Reinstate Worker Who Quit Over ‘BLM’ Logo Workplace Hazards and Violations Uniforms Dress Codes Black Lives Matter Movement Discrimination Race and Ethnicity Shopping and Retail Home Depot Inc National Labor Relations Board Minnesota",Jesus Jiménez
News,Washington,U.S.,"How Alexander Smirnov managed to convince business partners, law enforcement agencies and politicians he had something of value to offer remains an enigma. Alexander Smirnov was, in many ways, the archetype of an informant operating in the shadowlands of the former Soviet Union — a profiteer, fixer and gossip who promoted his ability to make sense of a confusing landscape to American law enforcement agencies. The Informant Turned Defendant Who Took Aim at the Bidens Smirnov, Alexander (Informant) Burisma Holdings Ltd Federal Bureau of Investigation Justice Department Biden, Hunter Biden, Joseph R Jr Republican Party House Committee on Oversight and Government Reform Impeachment United States Politics and Government Rumors and Misinformation Informers",Glenn Thrush
News,Arts & Culture,Movies,"Concerned about the future of moviegoing in the filmmaking capital, Jason Reitman and a group of distinguished directors purchased the historic Village Theater in Westwood. With the moviegoing experience under threat from streaming services and ever-improving home entertainment options, a group with a passionate interest in its preservation — three dozen filmmakers who create their works for the big screen, to be enjoyed in the company of large audiences — has decided to do something about it. Star Directors Buy Los Angeles Cinema With Plan for ‘Coolest AV Club’ Village Theater (Los Angeles, Calif) Theaters (Buildings) Historic Buildings and Sites Real Estate (Commercial) Reitman, Jason Movies Los Angeles (Calif)",Nicole Sperling
News,Express,U.S.,"The much-loved marsupial, Saffron, was known to frequent the French Quarter with his owner. A friend started a petition for the opossum’s return after state wildlife authorities seized him this month. A man in New Orleans lonesome for an opossum named Saffron, whom he had raised as a pet and dressed in a colorful sweater, is appealing to the authorities to return the animal, which was taken from him by state wildlife officials. A New Orleans Man Wants His Opossum Back. Thousands Have Joined His Plea. Opossums Pets Animal Abuse, Rights and Welfare New Orleans (La)",Emily Schmall
News,Politics,U.S.,"The former South Carolina governor has walked a fine line on reproductive medicine during the Republican presidential primary. Nikki Haley told NBC News on Wednesday that she believed that embryos created through in vitro fertilization were “babies,” after the Alabama Supreme Court on Friday delivered a major ruling that raised legal questions about reproductive medicine and fertility care. Haley Says ‘Embryos, to Me, Are Babies,’ in Response to Alabama Court Ruling Haley, Nikki R Embryos (Human) Alabama Reproductive Health (Journal)",Anjali Huynh
News,NYTNow,Briefing,"Also, President Biden canceled $1.2 billion in student loan debt. Here’s the latest at the end of Wednesday. The University of Alabama at Birmingham health system, which includes the state’s largest hospital, announced today that it would pause in vitro fertilization treatments after the Alabama Supreme Court ruled that frozen embryos in test tubes should be considered children. Alabama Hospital Paused I.V.F. Treatments After Court Ruling ",Matthew Cullen
Video,,Arts,"Final Fantasy VII, one of the most consequential games in history, is being remade by its creators. Zachary Small, a reporter for The New York Times, breaks down the characters, world and it’s impact. Final Fantasy VII, one of the most consequential games in history, is being remade by its creators. Zachary Small, a reporter for The New York Times, breaks down the characters, world and it’s impact. How Final Fantasy VII Changed the Gaming Landscape Computer and Video Games Final Fantasy VII Rebirth (Video Game) Final Fantasy VII Remake (Video Game)",Zachary Small
Review,Arts & Culture,Theater,"Moses Ingram makes her New York stage debut in Dominique Morisseau’s love poem to Nina Simone. Dominique Morisseau’s characters are, as the post-colonial thinker Frantz Fanon once described himself, often paralyzed “at the crossroads between nothingness and infinity.” Her plays craft realistic depictions of marginalized people inextricably caught in the tide of history. ‘Sunset Baby’ Review: Don’t Let Nina Be Misunderstood Theater Theater (Off Broadway) Signature Theater Co Broadnax, Steve H III Morisseau, Dominique Ingram, Moses (Actor) Sunset Baby (Play)",Juan Ramírez
News,Foreign,World,Israeli activists and their allies have expressed frustration at international organizations like the United Nations for slow responses to such reports. An Israeli organization that supports survivors of sexual abuse released a report on Wednesday concluding that acts of sexual violence against Israelis during and after the Hamas-led attack on Oct. 7 were “systematic and widespread.” Israeli Rape-Crisis Group Report Finds ‘Systematic’ Sexual Violence on and After Oct. 7 Israel-Gaza War (2023- ) Sex Crimes Terrorism Hamas United Nations Gaza Strip Israel,Adam Sella
News,Business,Technology,"The A.I. chip maker’s revenue more than tripled, and profits rose ninefold. It also projected that its revenue would more than triple again. Nvidia, the kingpin of chips powering artificial intelligence, on Wednesday released quarterly financial results that reinforced how the company has become one of the biggest winners of the artificial intelligence boom, and it said demand for its products would fuel continued sales growth. Nvidia Says Growth Will Continue as A.I. Hits ‘Tipping Point’ Artificial Intelligence Computers and the Internet Company Reports Computer Chips NVIDIA Corporation",Don Clark
News,Learning,The Learning Network,"Aleksei Navalny, the Russian opposition leader, died in a prison last week. Many of his supporters have been arrested. Why does this matter — for Russia and the world? For more than a decade, the anticorruption activist Aleksei A. Navalny was the leader of the opposition in President Vladimir V. Putin’s Russia. In 2020, Mr. Navalny survived a near-fatal poisoning attempt widely blamed on the Kremlin. After recovering in Germany, Mr. Navalny returned to Russia in 2021, and he was immediately arrested. Why Does the Right to Protest Matter? ",The Learning Network
News,Style & Fashion,Style,"While celebrating Jeremiah Brent’s first book, guests pondered the keys to a home, from lighting to artifacts of past lives. What makes a house a home? An HGTV Star’s Party Inspires a Question: What Makes a Home? Interior Design and Furnishings Television Parties (Social) Brent, Jeremiah HGTV Berkus, Nate Manhattan (NYC)",Melissa Kirsch
News,Style & Fashion,Style,"Leap day weddings hold a certain allure for some couples. After getting engaged in November, Claire Engstrom, 33, a registered nurse in Atlanta, proposed an idea to her fiancée: Why not get married on Feb. 29? Known as leap day, it is the date added to the end of February every four years to keep the calendar aligned with the seasons. How to Have Your First Anniversary in Four Years Weddings and Engagements Leap Year Marriages Superstitions",Alyson Krueger
News,Science,Science,"If all goes as planned, Odysseus, a private spacecraft, will touch down on the lunar surface on Thursday. It will be the first U.S. moon landing in more than 50 years. On Wednesday morning, a robotic lunar lander launched by a Houston company got closer to reaching the moon. U.S. Moon Landing: How to Watch and What to Know Private Spaceflight Space and Astronomy Moon Intuitive Machines LLC National Aeronautics and Space Administration Space Exploration Technologies Corp your-feed-science",Kenneth Chang
News,National,U.S.,"The U.A.B. system said it was worried about potential criminal prosecutions after Alabama’s Supreme Court ruled that frozen embryos should be considered children. The University of Alabama at Birmingham health system announced on Wednesday that it was pausing in vitro fertilization treatments as it evaluated the Alabama Supreme Court’s ruling that frozen embryos should be considered children. After Ruling, University of Alabama at Birmingham Health System Pauses I.V.F. Procedures Alabama Embryos (Human) In Vitro Fertilization Infertility University of Alabama at Birmingham Decisions and Verdicts Supreme Courts (State)",Anna Betts
News,Foreign,World,"A proposed marketing partnership with a private equity firm was abandoned after weeks of protests that disrupted matches across the country. Germany’s soccer fans had thrown everything they could at the problem, often in a quite literal sense: At various points over the last few weeks, they protested the specter of a private equity giant’s taking a stake in the country’s domestic league by raining tennis balls, chocolate coins and even marbles onto fields across the country. Bowing to Fan Revolt, German Soccer Rejects $1 Billion Investment Germany Soccer German Bundesliga Private Equity CVC Capital Partners Demonstrations, Protests and Riots",Rory Smith
briefing,NYTNow,World,"Also, a blow to Pakistan’s military and Niue’s fight for the .nu domain. U.S. intelligence agencies have told their closest European allies that if Russia is going to launch a nuclear weapon into orbit, it will probably do so this year. But, they warned, it might instead launch a harmless “dummy” warhead to leave the West guessing about its capabilities. Thursday Briefing: U.S. Warnings About a Russian Space Weapon Far East, South and Southeast Asia and Pacific Areas",Amelia Nierenberg
News,Business,Business Day,"The digital-media company, which has plunged in value, is selling the unit to Ntwrk at a significant discount from its 2021 purchase price. BuzzFeed said on Wednesday that it was selling Complex — a media start-up known for its coverage of streetwear and pop culture — at a significant discount from its purchase price. BuzzFeed Sells Complex, a Pop Culture Start-Up, for $108.6 Million Media BuzzFeed Inc NTWRK (Commerce Media Holdings LLC) Mergers, Acquisitions and Divestitures",Benjamin Mullin
News,Lifestyle & Leisure,Food,"In his new column, Ask Kenji, the cookbook author Kenji López-Alt answers your questions. First up: why smaller is better in the freezer. Welcome to my new column, Ask Kenji. I’ve spent the last decade and a half of my career rigorously researching and testing recipes, techniques and widely accepted kitchen wisdom to figure out the whys of cooking. I’ll try to answer the questions you’d answer yourself — if you had the resources and time, diving into research, tapping writers, chefs and scientists, and designing kitchen experiments to get to the bottom of your burning cooking questions. This week, we look at a reader question and figure out why, when it comes to the freezer, smaller (and faster) is better. Why Do Some Foods Freeze Better Than Others? Cooking and Cookbooks Frozen Foods Vegetables Content Type: Service",J. López-Alt
News,Washington,U.S.,"The president’s younger brother rebutted G.O.P. allegations against Joe Biden in impeachment testimony and portrayed himself as an anchor during family tragedy. When a young Joe Biden embarked on his first political campaign more than 50 years ago, it was his brother Jimmy who dropped out of college and crisscrossed the country to raise money for his bid. James Biden Tells Republicans His Brother Was Not Involved in Business Deals Biden, Joseph R Jr Biden, James Brian Biden, Hunter Impeachment Republican Party House of Representatives United States Politics and Government Federal Bureau of Investigation Smirnov, Alexander (Informant) Russia Burisma Holdings Ltd",Luke Broadwater
