type_of_material,news_desk,section_name,combined_text,author
News,Learning,The Learning Network,"This word has appeared in 993 articles on NYTimes.com in the past year. Can you use it in a sentence? The word reluctant has appeared in 993 articles on NYTimes.com in the past year, including on Jan. 29 in “He Stole Dorothy’s Ruby Slippers. He Thought They Had Real Rubies” by Michael Levenson: Word of the Day: reluctant ",The Learning Network
News,Arts & Culture,Movies,"With the victory, the Christopher Nolan biopic has swept the guild prizes, a strong predictor of its chances at the Academy Awards. There’s simply no stopping “Oppenheimer.” ‘Oppenheimer’ Wins Producers Guild Award. Is the Best-Picture Oscar Next? Academy Awards (Oscars) Movies Producers Guild of America Nolan, Christopher Oppenheimer (Movie)",Kyle Buchanan
Quote,Summary,Corrections,"Quotation of the Day for Monday, February 26, 2024. “We understand that Florida is weird. We embrace it.” Quotation of the Day: Florida Man Is In on the Joke, and Ready to Make a Game of It ",
News,Corrections,Corrections,"No corrections appeared in print on Monday, Feb. 26, 2024. Errors are corrected during the press run whenever possible, so some errors noted here may not have appeared in all editions. No Corrections: Feb. 26, 2024 ",
News,Arts & Culture,Arts,"FX premieres a new show set in Japan in the 1600s. A new mini-series starring Kate Winslet airs on HBO. For those like myself who still haven’t cut the cord, here is a selection of cable and network TV shows, movies and specials that broadcast this week, Feb. 26-March 3. Details and times are subject to change. What’s on TV This Week: ‘Shogun’ and ‘The Regime’ Television Movies",Shivani Gonzalez
Op-Ed,Opinion & Editorial,Opinion,"A more robust approach is needed to deter Chinese military activities that could escalate into a war. In 2020, the balance of military power in the Taiwan Strait began a gradual but profound shift in China’s favor. China Is Running Out of Lines to Cross in the Taiwan Strait Defense and Military Forces People's Liberation Army (China) China Taiwan Taiwan Strait",Ben Lewis
briefing,NYTNow,Briefing,"Ukraine said 31,000 of its soldiers had been killed. Some 31,000 Ukrainian soldiers have been killed since Russia’s full-scale invasion began two years ago, Ukraine’s president, Volodymyr Zelensky, said. It is the first time he has announced a concrete figure for Ukraine’s toll. Monday Briefing ",Daniel Slotnik
News,Foreign,World,"Kyle Parker says he delivered sniper gear as part of his unabashed support for Ukraine. Investigators say there may be “counterintelligence issues.” A senior Capitol Hill staff member who is a longtime voice on Russia policy is under congressional investigation over his frequent trips to Ukraine’s war zones and providing what he said was $30,000 in sniper gear to its military, documents show. Senate Aide Investigated Over Unofficial Actions in Ukraine Politics and Government United States Politics and Government Ethics and Official Misconduct Russian Invasion of Ukraine (2022) United States International Relations Defense and Military Forces Diplomatic Service, Embassies and Consulates Wilson, Addison Graves Sr House of Representatives Senate",Lara Jakes
News,Politics,U.S.,"With the state’s primary on Tuesday, speakers at a gathering in Dearborn, Mich., pushed voters to cast a ballot for “uncommitted” in objection to President Biden’s handling of the Israel-Hamas war. Two days before the Michigan Democratic primary, speakers at a rally on Sunday in Dearborn, Mich., urged voters to withhold their support from President Biden over his policy on the war in Gaza — and said that only Mr. Biden and Democrats who support his Israel policies would be to blame if the protest vote helped former President Donald J. Trump win in November. Rally in Michigan Urges Protest Vote Against Biden’s Israel Policies Israel-Gaza War (2023- ) Presidential Election of 2024 Arab-Americans Democratic Party Jewish Voice for Peace Inc United Automobile Workers Biden, Joseph R Jr Tlaib, Rashida Whitmer, Gretchen Dearborn (Mich)",Anjali Huynh
Interactive Feature,U.S.,U.S.,Most people of Middle Eastern and North African descent are classified as “white” in U.S. census data. Thousands of respondents to a Times survey told us how they actually identify. Most people of Middle Eastern and North African descent are classified as “white” in U.S. census data. Thousands of respondents to a Times survey told us how they actually identify. No Box to Check: When the Census Doesn’t Reflect You Census Census Bureau Race and Ethnicity United States Middle East North Africa Presidential Election of 2024,Karen Zraick
News,Express,Arts,"Professionally known as Shinsadong Tiger, he created the upbeat, catchy and danceable musical style that defined K-pop in the early 2010s. Lee Hoyang, a prolific producer and songwriter of South Korean pop music who was professionally known as Shinsadong Tiger and who helped create some of the biggest K-pop hits of the 2010s, died in Seoul on Friday. He was 40. Lee Hoyang, Prolific K-Pop Producer and Songwriter, Dies at 40 Pop and Rock Music Deaths (Obituaries) Music South Korea K-Pop",John Yoon
News,Express,Arts,"Known as “Peetah,” he and other children of the singer Denroy Morgan formed the group Morgan Heritage in the 1990s. Peter Anthony Morgan, the lead singer of the reggae band Morgan Heritage, a Grammy Award-winning group that was formed by children of the singer Denroy Morgan and came to be known for its varied influences and tight vocal harmonies, died on Sunday. Peter Anthony Morgan, Grammy-Winning Reggae Singer, Dies at 46 Reggae Music Deaths (Obituaries) Music",Mike Ives
News,Express,Arts,"Mr. Mitchell, a Canadian actor who appeared on “Star Trek: Discovery,” had A.L.S. Kenneth Mitchell, a Canadian actor known for his roles on the series “Star Trek: Discovery” and the film “Captain Marvel,” died on Saturday. He was 49. Kenneth Mitchell, Known for ‘Star Trek’ and ‘Captain Marvel’ Roles, Dies at 49 Actors and Actresses Deaths (Obituaries) Amyotrophic Lateral Sclerosis Movies Marvel Entertainment",Livia Albeck-Ripka
News,Washington,U.S.,"With Republicans insisting on adding right-wing policy measures to spending bills, lawmakers are running out of time to strike a deal to avert a partial government shutdown before a deadline of Friday at midnight. Congressional leaders have failed to reach a deal on legislation to keep federal funding going past Friday, with Republicans insisting on adding right-wing policy dictates to the spending bills, pushing the government to the brink of a partial shutdown within days. Spending Impasse Persists Amid G.O.P. Resistance as Partial Shutdown Looms United States Politics and Government Federal Budget (US) Foreign Aid Shutdowns (Institutional) Democratic Party Republican Party House of Representatives Senate Ukraine",Catie Edmondson
News,Politics,U.S.,"The group’s chief executive wrote in an email to staff on Sunday that it would now focus on House and Senate races. The political network created by the billionaire industrialist Koch brothers announced on Sunday that it was suspending its support for Nikki Haley in the presidential primary after her latest defeat in South Carolina. Months After Backing Haley, Koch Network Suspends Support for Her Campaign Presidential Election of 2024 Primaries and Caucuses Americans for Prosperity Politico, The Haley, Nikki R Koch, Charles G Trump, Donald J",Shane Goldmacher
News,Foreign,World,"Amid signs of progress toward a pause in the fighting, Prime Minister Benjamin Netanyahu said Israeli forces planned to keep pushing into Gaza. Prime Minister Benjamin Netanyahu said Sunday that Israeli forces would push into the southern Gaza Strip city of Rafah regardless of the outcome of talks to pause the fighting that appear to have been making some progress in recent days. Israeli Forces Will Move Into Rafah, Cease-Fire Deal or Not, Netanyahu Says Israel-Gaza War (2023- ) Peace Process Rafah (Gaza Strip) Netanyahu, Benjamin Hamas Gaza Strip Brennan, Margaret (1980- ) International Relations Politics and Government",Thomas Fuller
Review,Arts & Culture,Theater,"This modern-day fable, directed by Rupert Goold and starring Tobias Menzies, is styled with horror. “Each town has its witch/Each parish its troll,” a character sings ominously while sharpening hedge shears. “We will with pleasure/Take the life from their veins.” ‘The Hunt’ Review: The Hunter Becomes the Hunted Theater The Hunt (Play) Menzies, Tobias Theater (Off Broadway) Goold, Rupert",Elisabeth Vincentelli
News,Games,Crosswords & Games,Joe Marquez treats us to a clever Monday puzzle. Jump to: Today’s Theme | Tricky Clues Go Bad Crossword Puzzles Games,Sam Corbin
News,Express,Business Day,"Thousands of customers lost service on Thursday when the telecommunications company ran into problems while trying to expand its network, the company’s chief executive said. AT&T will offer a $5 credit to customers affected by a widespread outage on Thursday that was caused by technical issues the company encountered while trying to expand its network, its chief executive said on Sunday. AT&T Offers $5 Credit to Customers Affected by Service Outage Cellular Telephones AT&T Inc Computer Network Outages Telephones and Telecommunications Shutdowns (Institutional) Customer Relations",Rebecca Carballo
News,National,U.S.,"Nex Benedict, a 16-year-old student, died one day after an altercation with classmates in a school bathroom in Oklahoma, renewing scrutiny over the state’s strict gender policies. The death of a 16-year-old nonbinary student after an altercation in a high school girls’ bathroom in Oklahoma has drawn national attention and outrage from gay and transgender rights groups that say the student had been bullied because of their gender identity. What We Know About the Death of a Nonbinary Student in Oklahoma Gender Transgender Oklahoma Benedict, Nex (d 2024) Walters, Ryan (1985- ) Teenagers and Adolescence School Discipline (Students)",Colbi Edmonds
News,Style & Fashion,Style,"A mix of casual and chic attire made the 39th annual awards show worth watching. “The Independent Spirit Awards, where the dress code is, get dressed,” said John Mulaney during his bit at the 2018 show, which he co-hosted along with comedian Nick Kroll.  The Best Looks From the Independent Spirit Awards Independent Spirit Awards Fashion and Apparel Celebrities",The Styles Desk
News,Express,World,"Kathy Brandel and Ralph Hendry were on their yacht in the Caribbean. The authorities are looking into whether their disappearance is connected to a prisoner escape. An American couple who had departed from Virginia and were spending the winter cruising in the Caribbean went missing this month while sailing off Grenada, and their boat turned up empty in neighboring St. Vincent and the Grenadines. American Couple Goes Missing While Sailing Off Grenada Sailboats and Sailing Grenada St Vincent St Vincent and the Grenadines Prison Escapes Caribbean Area International Relations",Johnny Diaz
News,Foreign,World,"The Israeli leader reiterated plans for a military operation in the southern Gaza city that he says is essential to eliminating Hamas. Prime Minister Benjamin Netanyahu of Israel said on Sunday that progress toward a deal for a temporary cease-fire and the release of some hostages held in Gaza would require Hamas to soften its demands, while asserting that any agreement would delay, but not ultimately prevent, an Israeli ground invasion of Rafah. Netanyahu Says Hostage Deal Would Delay, but Not Stop Rafah Invasion Israel-Gaza War (2023- ) Rafah (Gaza Strip) Netanyahu, Benjamin Hamas Qatar",Anushka Patil
briefing,NYTNow,Briefing,"Plus a look at public sentiment in Ukraine. An Israeli delegation is expected to arrive in Qatar as soon as today for talks on a new deal for a temporary cease-fire with Hamas and the release of some hostages held in Gaza, according to an Israeli official. Monday Briefing: Hostage Talks to Continue in Qatar ",Jonathan Wolfe
News,Washington,World,"The man, who filmed and livestreamed the protest, was taken to a hospital with life-threatening injuries. The U.S. Air Force confirmed he was an active-duty airman. A man set himself on fire on Sunday afternoon outside the Israeli Embassy in Washington, according to the Metropolitan Police Department. A U.S. Air Force spokeswoman, Ann Stefanek, confirmed on Sunday night that the man was an active-duty airman. A man set himself on fire outside the Israeli Embassy in Washington, the police said. Israel-Gaza War (2023- ) Washington (DC) Bombs and Explosives Secret Service",Aishvarya Kavi
News,Science,Health,"Xolair cuts the risk of dangerous reactions after exposure to minute amounts of allergens, researchers reported. But people taking it still must avoid risky foods. A drug that has been used for decades to treat allergic asthma and hives significantly reduced the risk of life-threatening reactions in children with severe food allergies who were exposed to trace amounts of peanuts, cashews, milk and eggs, researchers reported on Sunday. Drug Drastically Reduces Children’s Reactions to Traces of Food Allergens your-feed-science Allergies Food Peanuts Children and Childhood Research Drugs (Pharmaceuticals) Immune System Eggs Milk Clinical Trials American Academy of Allergy Asthma and Immunology New England Journal of Medicine Genentech Inc",Roni Rabin
News,Science,Health,"The drug does not completely prevent reactions, but it can reduce the risks posed by trace amounts of food allergens. The Food and Drug Administration approved a drug this month that cuts the risk of severe reactions in children and adults exposed to trace amounts of peanuts, tree nuts, milk, dairy and other food allergens — a move that could dramatically improve quality of life for people coping with these risks. The results of the clinical trial supporting the decision were published on Sunday. What to Know About Xolair and Food Allergies your-feed-science Allergies Food Children and Childhood Drugs (Pharmaceuticals) Immune System Clinical Trials Research Health Insurance and Managed Care",Roni Rabin
News,Politics,U.S.,"A decision in Alabama’s Supreme Court, which pointed to the overturning of Roe v. Wade, has rocked presidential and congressional campaigns. More than a week after the Alabama Supreme Court declared that frozen embryos produced for in vitro fertilization were people with legal rights, upending fertility care in the state, the ruling is reverberating nationally, putting Republicans on the defensive. Republicans Struggle to Respond as Democrats Emphasize the Alabama I.V.F. Ruling Presidential Election of 2024 Alabama Republican Party Democratic Party In Vitro Fertilization",Maggie Astor
News,Express,Business Day,"The man made $1.7 million in profits after buying and selling stocks in a company that his wife’s employer, BP, acquired, prosecutors said. A Texas man pleaded guilty to insider trading after he was accused of making $1.7 million in illegal profits by purchasing and selling stocks based on his wife’s work conversations, which he had overheard while she was working remotely at home, federal prosecutors said on Thursday. Man Pleads Guilty to Insider Trading After Overhearing Wife’s Work Calls Decisions and Verdicts Mergers, Acquisitions and Divestitures Telecommuting Securities and Commodities Violations Suits and Litigation (Civil) BP Plc Securities and Exchange Commission TravelCenters of America Houston (Tex) Insider Trading",Amanda Holpuch
News,Politics,U.S.,"The pastime of sailing is distinctly intertwined with the Kennedys. The prize is another not-so-subtle attempt to channel Camelot: saltwater, wind and an afternoon sailing with the scion of a liberal political dynasty. Sailing With a Kennedy? A Contest Winner Can Join R.F.K. Jr. at Sea. Presidential Election of 2024 Contests and Prizes Sailboats and Sailing United States Politics and Government Political Advertising Campaign Finance Democratic Party Conspiracy Theories Kennedy, Robert F Jr Kennedy Family Kennedy, John Fitzgerald Kennedy, Robert Francis",Neil Vigdor
News,Arts & Culture,Arts,"The singer, best known in the works of Wagner and Strauss, is starring in the Metropolitan Opera’s new production of Verdi’s “La Forza del Destino.” Lise Davidsen, who grew up in Norway playing sports and considering a future in songwriting, didn’t see Italian opera onstage until she was working on her master’s degree as a budding soprano in Copenhagen. Lise Davidsen, Star Soprano of the Met, Takes an Italian Turn Opera Metropolitan Opera Davidsen, Lise La Forza del Destino (Opera) Content Type: Personal Profile",Joshua Barone
Video,,World,"Protesters gathered to demand the resignation of Prime Minister Benjamin Netanyahu of Israel. Protesters gathered to demand the resignation of Prime Minister Benjamin Netanyahu of Israel. Antigovernment Activists and the Police Clash in Tel Aviv Demonstrations, Protests and Riots Netanyahu, Benjamin Tel Aviv (Israel)",The Associated Press
News,Foreign,World,"The tally that President Volodymyr Zelensky revealed on Sunday differs sharply from that given by U.S. officials, who have said the number is closer to 70,000. Some 31,000 Ukrainian soldiers have been killed since Russia’s full-scale invasion began two years ago, President Volodymyr Zelensky said on Sunday, acknowledging for the first time in the war a concrete figure for Ukraine’s toll. 31,000 Ukrainian Soldiers Killed in Two Years of War, Zelensky Says Russian Invasion of Ukraine (2022) Politics and Government Defense and Military Forces Zelensky, Volodymyr Russia Ukraine",Carlotta Gall
News,Politics,U.S.,"Ms. Haley has rallies planned in Detroit and Grand Rapids ahead of G.O.P. contests that begin Tuesday. Nikki Haley, fresh off another defeat by former President Donald J. Trump, brought her sputtering campaign on Sunday to Michigan, warning that even if Mr. Trump clinches the 2024 Republican nomination he has too much baggage to win in November. In Michigan, Nikki Haley Warns Trump Can’t Win in November Haley, Nikki R Michigan Presidential Election of 2024 Republican Party Elections Primaries and Caucuses Trump, Donald J",Jazmine Ulloa
Letter,Lifestyle & Leisure,Food,"“Those meatballs” being Suzanne Goin’s lamb meatballs in spicy tomato sauce. Good morning. I like a savory breakfast on the weekend — maybe a bowl of congee studded with peanuts or a roast beef hero with gravy and mozzarella. Occasionally, there’s a mad dash to Queens for early doubles at Trinciti or a first-in-the-door shrimp and grits at Bubby’s in Manhattan. Those are nice mornings. Hoecakes for Weekend Breakfast; ‘Those Meatballs’ for Weeknight Dinner Cooking and Cookbooks Content Type: Service",Sam Sifton
Letter,Letters,Opinion,"Readers discuss a column by Nicholas Kristof urging young people to expand their horizons. Also: Joe Biden’s experience; climate science; marriage tips. To the Editor: Getting Out of Your Comfort Zone With Travel Youth Volunteers and Community Service Travel and Vacations Education Kristof, Nicholas D Biden, Joseph R Jr Trump, Donald J United States Politics and Government Presidential Election of 2024 Global Warming Libel and Slander Mann, Michael E Marriages",
News,Other,The Upshot,"Five months after the expiration of federal funds, running a child care business is more precarious than ever and many parents are struggling to pay tuition, two surveys show. Running a child care business has long been a very challenging math problem: Many providers can barely afford to operate, yet many parents cannot afford to pay more. With Pandemic Money Gone, Child Care Is an Industry on the Brink Child Care Day Care Centers Labor and Jobs Federal Aid (US) Parenting Shortages Polls and Public Opinion",Claire Miller
News,National,U.S.,"A mullet contest, a “mud duel” with pool noodles, an “evading arrest” obstacle course — and a chance to mull why the meme that launched it all keeps hanging on. The idea came to Pete Melfi, a radio personality turned podcaster in St. Augustine, Fla., last year after he organized “the laziest race in the history of races,” a .5-kilometer beer run, and the participants had a grand old time. In on the Joke at the First-Ever Florida Man Games Florida St Augustine (Fla) Games",Patricia Mazzei
Op-Ed,Opinion & Editorial,Opinion,"Spring training means new hope for a glorious season. But for me, it’s the prospect of losing that keeps me hooked. The familiar emptiness hit me in the pit of my stomach. For the second time in five years my beloved 49ers had blown a 10-point lead to the Kansas City Chiefs and lost the Super Bowl. As soon as the game was over I turned away from the screen, quietly thanked my party hosts, went home to feed my cat and grew determined to not read about or watch sports for a long while. I may have muttered the phrase “I hate sports” several times over the next few days. Baseball Is Designed to Break Your Heart Baseball Kansas City Chiefs San Francisco Giants Giamatti, A Bartlett",Chris Vognar
Op-Ed,Opinion & Editorial,Opinion,"And what is it not? If you’re alarmed by the rise of Christian nationalism, the single worst thing you can do is define it too broadly. If you define it too broadly, then you’re telling millions of ordinary churchgoing citizens that the importation of their religious values into the public square somehow places them in the same camp or on the same side as actual Christian supremacists, the illiberal authoritarians who want to remake America in their own fundamentalist image. What Is Christian Nationalism, Exactly? Trump, Donald J King, Martin Luther Jr Reiner, Rob Christians and Christianity Nationalism (Theory and Philosophy) Fringe Groups and Movements Civil Rights Movement (1954-68) Storming of the US Capitol (Jan, 2021)",David French
Op-Ed,Opinion & Editorial,Opinion,"Humans are hard-wired to adjust to changing circumstances. And that’s why terrible changes can occur slowly without much protest. The miraculous history of our species is peppered with dark stories of oppression, tyranny, bloody wars, savagery, murder and genocide. When looking back, we are often baffled and ask: Why weren’t the horrors halted earlier? How could people have lived with them? Why People Fail to Notice Horrors Around Them Brain War Crimes, Genocide and Crimes Against Humanity Sociology Psychology and Psychologists Milgram, Stanley",Tali Sharot
Op-Ed,Opinion & Editorial,Opinion,"Chaim Soutine’s identity was never integral to his art, even as a Jew whose death Nazis caused. Artists in Gaza, Syria and Ukraine share his universality. Pablo Picasso was among the few who stood beside Chaim Soutine’s grave as his corpse was lowered into it. It was Aug. 11, 1943, and Paris was under Nazi occupation. Mr. Soutine — the artist, the genius, the Jew — had died in his hospital bed with his belly cut open after being smuggled into the city in a black-and-white-flagged ambulance to avoid Nazi detection. When Artists Can’t Go Home, All That’s Left Is Their Art Jews and Judaism Holocaust and the Nazi Era Refugees and Displaced Persons Art War Crimes, Genocide and Crimes Against Humanity Death and Dying Louisiana Museum Soutine, Chaim Modigliani, Amedeo Abu Toha, Mosab van Rijn, Rembrandt Harmenszoon Copenhagen (Denmark) Eastern Europe France Gaza Strip",Celeste Marcus
briefing,NYTNow,Briefing,"A remake of Final Fantasy VII is one of the most anticipated video game releases of the year. For years, video game fans clamored for a remake of the beloved 1997 game Final Fantasy VII. After all, we are in an era of sequels, reboots and remakes, with three different live-action versions of Spider-Man in theaters in the last 20 years. Why not do the same with one of the most acclaimed games of all time? A ’90s Classic, Remade internal-storyline-no Computer and Video Games Final Fantasy VII Rebirth (Video Game)",German Lopez
News,Foreign,World,"The opposition in exile has called for a boycott of the parliamentary vote, which includes only parties that support Aleksandr G. Lukashenko, who has ruled the country for 30 years. Amid a number of high-stakes elections to be held around the world this year, the East European nation of Belarus on Sunday offered an alternative to the unpredictability of democracy: a vote for Parliament without a single candidate critical of the country’s despotic leader. Belarus Holds an Election, but the Outcome Is Not Hard to Predict Politics and Government Elections Russian Invasion of Ukraine (2022) Tikhanovskaya, Svetlana Lukashenko, Aleksandr G Belarus",Andrew Higgins
Obituary (Obit),Business,Business Day,"A bitter but successful battle with Danone of France for control of a joint venture made him the richest person in China for a time. Zong Qinghou, a self-made beverage entrepreneur who was once the richest person in China, died on Sunday. Zong Qinghou, Beverage Tycoon in China, Dies at 79 Deaths (Obituaries) Beverages Mergers, Acquisitions and Divestitures Zong Qinghou (1945-2024) Wahaha Group Groupe Danone SA China",Tiffany May
